{"id":"early-lesson-08","sequence":8,"track":"early-learner","stage":"discover","strand":"listening-and-attention","title":"Hear the sound","objective":"Distinguish a high chime from a low drum sound.","instruction":"Listen. Find the sound you heard.","activity":{"type":"sound-match","prompt":"Tap the sound you heard","choices":[{"id":"drum","visual":"\ud83e\udd41","label":"Drum","position":"left","sound":"drum"},{"id":"chime","visual":"\ud83d\udd14","label":"Chime","position":"right","sound":"chime"}],"correctAnswerId":"drum","visibleTextLabels":false,"targetSound":"drum","heroVisual":"\ud83d\udc42"},"audio":{"instruction":"assets/audio/early-instruction-same-sound.wav","target":"synthetic:clap","retry":"assets/audio/lesson-retry.wav","success":"assets/audio/lesson-success.wav"},"feedback":{"incorrect":"Listen again. You can do it.","correct":"Yes! You heard the sound!","complete":"Yay, you noticed the sound!"},"progress":{"totalLessons":15,"position":8}}
